<?xml version="1.0" encoding="utf-8" ?>
<AdapterMetadata xmlns:xsi="http://www.w3.org/2001/XMLSchema-instance" xsi:noNamespaceSchemaLocation="AdapterMetadataSchema.xsd">
    <adapterId>ZipTie::Adapters::Nortel::Tiara</adapterId>
    <supportedModelVersion>1.0</supportedModelVersion>
    <shortName>Nortel Tiara</shortName>
    <description>Adapter to parse Nortel Tiara devices</description>
    <softwareVersionRegEx>r(\d+)\.(\d+)\.(\d+)</softwareVersionRegEx>
    <biosVersionRegEx>([\d]+)\.([\d]+)</biosVersionRegEx>
    <lastRebootThreshold>5</lastRebootThreshold>
    <errorForms>
    </errorForms>
    <operationConstraints>
        <operation name="backup">
            <supportedProtocolSet>Telnet-SNMP</supportedProtocolSet>
            <supportedProtocolSet>SSH-SNMP</supportedProtocolSet>
            <supportedProtocolSet>Telnet-SNMP-TFTP</supportedProtocolSet>
            <supportedProtocolSet>SSH-SNMP-TFTP</supportedProtocolSet>
        </operation>
        <operation name="commands">
            <supportedProtocolSet>Telnet</supportedProtocolSet>
            <supportedProtocolSet>SSH</supportedProtocolSet>
        </operation>
    </operationConstraints>
    <discoveryMappings>
    </discoveryMappings>
</AdapterMetadata>
