<?xml version="1.0" encoding="utf-8" ?>
<AdapterMetadata xmlns:xsi="http://www.w3.org/2001/XMLSchema-instance" xsi:noNamespaceSchemaLocation="AdapterMetadataSchema.xsd">
    <adapterId>ZipTie::Adapters::Nortel::Contivity</adapterId>
    <supportedModelVersion>1.0</supportedModelVersion>
    <shortName>Nortel Contivity</shortName>
    <description>Nortel Contivity VPN Switches</description>
    <softwareVersionRegEx>(\d+)\.(\d+)</softwareVersionRegEx>
    <biosVersionRegEx>(\d+)\.(\d+)</biosVersionRegEx>
    <lastRebootThreshold>5</lastRebootThreshold>
    <errorForms>
        <errorRegEx>% Invalid input detected</errorRegEx>
    </errorForms>
    <operationConstraints>
        <operation name="backup">
            <supportedProtocolSet>Telnet-FTP</supportedProtocolSet>
            <supportedProtocolSet>SSH-FTP</supportedProtocolSet>
        </operation>
        <operation name="commands">
            <supportedProtocolSet>Telnet</supportedProtocolSet>
            <supportedProtocolSet>SSH</supportedProtocolSet>
        </operation>
    </operationConstraints>
    <discoveryMappings>
    </discoveryMappings>
</AdapterMetadata>
