<?xml version="1.0" encoding="utf-8" ?>
<AdapterMetadata xmlns:xsi="http://www.w3.org/2001/XMLSchema-instance" xsi:noNamespaceSchemaLocation="AdapterMetadataSchema.xsd">
    <adapterId>ZipTie::Adapters::Nortel::Passport1600</adapterId>
    <supportedModelVersion>1.0</supportedModelVersion>
    <shortName>Nortel Passport-1600</shortName>
    <description>Nortel Passport 1600 Series Switches</description>
    <softwareVersionRegEx>(\d+)\.(\d+)</softwareVersionRegEx>
    <biosVersionRegEx>(\d+)\.(\d+)</biosVersionRegEx>
    <lastRebootThreshold>5</lastRebootThreshold>
    <errorForms>
    </errorForms>
    <operationConstraints>
        <operation name="backup">
            <supportedProtocolSet>Telnet-TFTP</supportedProtocolSet>
            <supportedProtocolSet>SSH-TFTP</supportedProtocolSet>
        </operation>
        <operation name="commands">
            <supportedProtocolSet>Telnet</supportedProtocolSet>
            <supportedProtocolSet>SSH</supportedProtocolSet>
        </operation>
		<operation name="restore">
            <supportedProtocolSet>Telnet-TFTP</supportedProtocolSet>
            <supportedProtocolSet>SSH-TFTP</supportedProtocolSet>
        </operation>
    </operationConstraints>
    <discoveryMappings>
        <matchRegex dataSource="sysDescr" regex="Passport-?16\d\d" ignoreCase="true" multiline="false" singleline="false"/>
    </discoveryMappings>
</AdapterMetadata>
