<?xml version="1.0" encoding="utf-8" ?>
<AdapterMetadata xmlns:xsi="http://www.w3.org/2001/XMLSchema-instance" xsi:noNamespaceSchemaLocation="AdapterMetadataSchema.xsd">
    <adapterId>ZipTie::Adapters::Enterasys::SSR</adapterId>
    <supportedModelVersion>1.0</supportedModelVersion>
    <shortName>Enterasys SSR</shortName>
    <description>Enterasys X-Pedition Switch Routers</description>
    <softwareVersionRegEx>(\d+)\.(\d+)</softwareVersionRegEx>
    <biosVersionRegEx>(\d+)\.(\d+)</biosVersionRegEx>
    <lastRebootThreshold>5</lastRebootThreshold>
    <errorForms>
    </errorForms>
    <operationConstraints>
        <operation name="backup">
            <supportedProtocolSet>Telnet-TFTP-SNMP</supportedProtocolSet>
            <supportedProtocolSet>SSH-TFTP-SNMP</supportedProtocolSet>
        </operation>
        <operation name="commands">
            <supportedProtocolSet>Telnet</supportedProtocolSet>
            <supportedProtocolSet>SSH</supportedProtocolSet>
        </operation>
		<operation name="restore">
            <supportedProtocolSet>Telnet-TFTP</supportedProtocolSet>
            <supportedProtocolSet>SSH-TFTP</supportedProtocolSet>
			<restoreValidationRegex>startup-config</restoreValidationRegex>
        </operation>
    </operationConstraints>
    <discoveryMappings>
    </discoveryMappings>
</AdapterMetadata>
