<?xml version="1.0" encoding="utf-8" ?>
<AdapterMetadata xmlns:xsi="http://www.w3.org/2001/XMLSchema-instance" xsi:noNamespaceSchemaLocation="AdapterMetadataSchema.xsd">
    <adapterId>ZipTie::Adapters::Cisco::CatOS</adapterId>
    <supportedModelVersion>1.0</supportedModelVersion>
    <shortName>Cisco CatOS</shortName>
    <description>Cisco Catalyst Switches running CatOS</description>
    <softwareVersionRegEx>(\d+)\.(\d+)</softwareVersionRegEx>
    <biosVersionRegEx>(\d+)\.(\d+)</biosVersionRegEx>
    <lastRebootThreshold>5</lastRebootThreshold>
    <errorForms>
        <errorRegEx>Usage: [^\n\r]+[\n\r]\s*$</errorRegEx>
        <errorRegEx>Unknown command &quot;.*&quot;</errorRegEx>
    </errorForms>
    <operationConstraints>
        <operation name="backup">
            <supportedProtocolSet>Telnet</supportedProtocolSet>
            <supportedProtocolSet>Telnet-TFTP</supportedProtocolSet>
            <supportedProtocolSet>SSH</supportedProtocolSet>
            <supportedProtocolSet>SSH-TFTP</supportedProtocolSet>
            <supportedProtocolSet>SSH-SCP</supportedProtocolSet>
        </operation>
        <operation name="restore">
            <supportedProtocolSet>Telnet-TFTP</supportedProtocolSet>
            <supportedProtocolSet>SSH-TFTP</supportedProtocolSet>
            <supportedProtocolSet>SSH-SCP</supportedProtocolSet>
            <restoreValidationRegex>config</restoreValidationRegex>
        </operation>
        <operation name="commands">
            <supportedProtocolSet>Telnet</supportedProtocolSet>
            <supportedProtocolSet>SSH</supportedProtocolSet>
        </operation>
        <operation name="syslogsetup">
            <supportedProtocolSet>Telnet</supportedProtocolSet>
            <supportedProtocolSet>SSH</supportedProtocolSet>
        </operation>
        <operation name="ntpserverchange">
            <supportedProtocolSet>Telnet</supportedProtocolSet>
            <supportedProtocolSet>SSH</supportedProtocolSet>
        </operation>
        <operation name="snmpcommunitychange">
            <supportedProtocolSet>Telnet</supportedProtocolSet>
            <supportedProtocolSet>SSH</supportedProtocolSet>
        </operation>
        <operation name="loginbanner">
            <supportedProtocolSet>Telnet</supportedProtocolSet>
            <supportedProtocolSet>SSH</supportedProtocolSet>
        </operation>
        <operation name="interfacechange">
            <supportedProtocolSet>Telnet</supportedProtocolSet>
            <supportedProtocolSet>SSH</supportedProtocolSet>
        </operation>
        <operation name="portvlan">
            <supportedProtocolSet>Telnet</supportedProtocolSet>
            <supportedProtocolSet>SSH</supportedProtocolSet>
        </operation>
    </operationConstraints>
    <discoveryMappings>
    	<matchRegex dataSource="sysDescr" regex="(CatOS|Catalyst Operating System)" singleline="false" multiline="false" ignoreCase="true"></matchRegex>
    </discoveryMappings>
</AdapterMetadata>
