<?xml version="1.0" encoding="utf-8" ?>
<AdapterMetadata xmlns:xsi="http://www.w3.org/2001/XMLSchema-instance" xsi:noNamespaceSchemaLocation="AdapterMetadataSchema.xsd">
    <adapterId>ZipTie::Adapters::Cisco::CS500</adapterId>
    <supportedModelVersion>1.0</supportedModelVersion>
    <shortName>Cisco CS500</shortName>
    <description>Cisco CS500 Terminal Servers</description>
    <softwareVersionRegEx>([\d]+)\.*(\d*)\(*(\d*)\)*</softwareVersionRegEx>
    <biosVersionRegEx>([\d]+)\.*(\d*)\(*(\d*)\)*</biosVersionRegEx>
    <lastRebootThreshold>5</lastRebootThreshold>
    <errorForms>
    </errorForms>
    <operationConstraints>
        <operation name="backup">
            <supportedProtocolSet>Telnet</supportedProtocolSet>      
            <supportedProtocolSet>SSH</supportedProtocolSet>      
        </operation>
        <operation name="commands">
            <supportedProtocolSet>Telnet</supportedProtocolSet>
            <supportedProtocolSet>SSH</supportedProtocolSet>
        </operation>
		<operation name="restore">
            <supportedProtocolSet>Telnet-TFTP</supportedProtocolSet>      
            <supportedProtocolSet>SSH-TFTP</supportedProtocolSet>      
        </operation>
    </operationConstraints>
    <discoveryMappings>
      <matchRegex dataSource="sysDescr" regex="CS Software.*" ignoreCase="true" multiline="false" singleline="false"/>
    </discoveryMappings>
</AdapterMetadata>
