<?xml version="1.0" encoding="utf-8" ?>
<AdapterMetadata xmlns:xsi="http://www.w3.org/2001/XMLSchema-instance" xsi:noNamespaceSchemaLocation="AdapterMetadataSchema.xsd">
    <adapterId>ZipTie::Adapters::CheckPoint::SecurePlatform</adapterId>
    <supportedModelVersion>1.0</supportedModelVersion>
    <shortName>Check Point SecurePlatform</shortName>
    <description>Check Point SecurePlatform</description>
    <softwareVersionRegEx>\((\S\d+)\).+Build\s+(\d+)</softwareVersionRegEx>
    <biosVersionRegEx>(\S+)</biosVersionRegEx>
    <lastRebootThreshold>5</lastRebootThreshold>
    <errorForms>
    </errorForms>
    <operationConstraints>
        <operation name="backup">
            <supportedProtocolSet>Telnet-TFTP</supportedProtocolSet>
            <supportedProtocolSet>SSH-TFTP</supportedProtocolSet>
        </operation>
        <operation name="commands">
            <supportedProtocolSet>Telnet</supportedProtocolSet>
            <supportedProtocolSet>SSH</supportedProtocolSet>
        </operation>
        <operation name="restore">
            <supportedProtocolSet>Telnet-TFTP</supportedProtocolSet>
            <supportedProtocolSet>SSH-TFTP</supportedProtocolSet>
            <restoreValidationRegex>rules.C|objects.C</restoreValidationRegex>
        </operation>
    </operationConstraints>
    <discoveryMappings>
        <matchRegex dataSource="sysDescr" regex="NGX" ignoreCase="false" multiline="false" singleline="false"/>
    </discoveryMappings>
</AdapterMetadata>
