<?xml version="1.0" encoding="utf-8" ?>
<AdapterMetadata xmlns:xsi="http://www.w3.org/2001/XMLSchema-instance" xsi:noNamespaceSchemaLocation="AdapterMetadataSchema.xsd">
    <adapterId>ZipTie::Adapters::Foundry::FastIron</adapterId>
    <supportedModelVersion>1.0</supportedModelVersion>
    <shortName>Foundry FastIron</shortName>
    <description>Foundry FastIron and ServerIron Devices</description>
    <softwareVersionRegEx>(\d+)\.(\d+)(\.(\S+))?</softwareVersionRegEx>
    <biosVersionRegEx>(\d+)\.(\d+)(\.(\S+))?</biosVersionRegEx>
    <lastRebootThreshold>5</lastRebootThreshold>
    <errorForms>
	<errorRegEx>%Syntax(.+)%</errorRegEx>
	<errorRegEx>%Invalid(.+)%</errorRegEx>
    </errorForms>
    <operationConstraints>
        <operation name="backup">
            <supportedProtocolSet>Telnet-TFTP</supportedProtocolSet>
            <supportedProtocolSet>SSH-TFTP</supportedProtocolSet>
        </operation>
        <operation name="commands">
            <supportedProtocolSet>Telnet</supportedProtocolSet>
            <supportedProtocolSet>SSH</supportedProtocolSet>
        </operation>
		<operation name="restore">
            <supportedProtocolSet>Telnet-TFTP</supportedProtocolSet>
            <restoreValidationRegex>startup-config</restoreValidationRegex>
        </operation>
    </operationConstraints>
    <discoveryMappings>
	<matchRegex dataSource="sysDescr" regex="Foundry\sNetworks.+(ServerIron|FastIron|IronWare)" ignoreCase="true" multiline="false"	singleline="false"/>
    </discoveryMappings>
</AdapterMetadata>
