<?xml version="1.0" encoding="utf-8" ?>
<AdapterMetadata xmlns:xsi="http://www.w3.org/2001/XMLSchema-instance" xsi:noNamespaceSchemaLocation="AdapterMetadataSchema.xsd">
    <adapterId>ZipTie::Adapters::Nortel::BayStack</adapterId>
    <supportedModelVersion>1.0</supportedModelVersion>
    <shortName>Nortel BayStack</shortName>
    <description>Nortel BayStack Family Switches (BayStack, BPS)</description>
    <softwareVersionRegEx>[Vv]*([\d]+)\.*(\d*)\.*(\d*)\.*(\d*)</softwareVersionRegEx>
    <biosVersionRegEx>[Vv]*([\d]+)\.*(\d*)</biosVersionRegEx>
    <lastRebootThreshold>5</lastRebootThreshold>
    <errorForms>
        <errorRegEx>Previous operation is currently in progress</errorRegEx>
        <errorRegEx>Load host not found or not responding</errorRegEx>
        <errorRegEx>TFTP unknown error</errorRegEx>
        <errorRegEx>Operation aborted</errorRegEx>
    </errorForms>
    <operationConstraints>
        <operation name="reboot">
            <supportedProtocolSet>Telnet</supportedProtocolSet>
            <supportedProtocolSet>SSH</supportedProtocolSet>
        </operation>
        <operation name="backup">
            <supportedProtocolSet>Telnet-TFTP-SNMP</supportedProtocolSet>
            <supportedProtocolSet>SSH-TFTP-SNMP</supportedProtocolSet>
        </operation>
        <operation name="restore">
            <supportedProtocolSet>Telnet-TFTP</supportedProtocolSet>
            <supportedProtocolSet>SSH-TFTP</supportedProtocolSet>
            <restoreValidationRegex>^/?config</restoreValidationRegex>
        </operation>
        <operation name="commands">
            <supportedProtocolSet>Telnet</supportedProtocolSet>
            <supportedProtocolSet>SSH</supportedProtocolSet>
        </operation>
    </operationConstraints>
    <discoveryMappings>
        <matchRegex dataSource="sysDescr" regex="Business Policy Switch|BayStack|Ethernet Routing Switch" ignoreCase="true" multiline="false" singleline="false"/>
    </discoveryMappings>
</AdapterMetadata>
